"ID","klimatischer Stressor","Impact","Branche(n)","Unternehmensbereich","Unternehmen","Land","Naturraum","Beschreibung","Textstelle(n)","Spalte1","Spalte2","Spalte3","Spalte4","Spalte5","Spalte6","Spalte7","Spalte8","Spalte9","Spalte10"
,"Starkregen","steigende Unfallgefahr während Starkregen auf Grund schlechter Sicht und Aquaplaning --> mögliche Schäden an Fahrer, Lkw und Ware","Logistik","Personal; Betriebsmittel","Spedition Kleyling; Doll; Dischinger","Deutschland","Tieflagen, mittlere Lagen, Hochlagen",,"Die Fahrer werden halt aufgefordert angepasst zu fahren. Die Frage ist halt kann man fahren und wenn man fahren kann grundsätzlich bei Starkregen hat man nasse Fahrbahnen und da sind dann natürlich alle aufgefordert die Fahrweise entsprechend anzupassen, das ist klar. Ökonomisch und auch sicherheitstechnische Fahrweise, damit man nicht im Graben landen wegen Aquaplaning, weil das ist dann immer gleich recht teuer. Der LKW hat im schlimmsten Fall einen Totalschaden plus die Ware, die geladen war, das wird dann schon recht teuer. Insofern haben die Fahren schon diese Verhaltensregeln und wenn es jetzt wirklich bekannt ist das ein Weg, ein Zugangsweg zur Arbeitsstelle nicht zugänglich ist, dann wird es angekündigt","Doll: Im Grunde sehen wir nur bei Starkregenereignissen dann ein Problem, wenn man sagt, ja ok das ist ja in dem Fall höhere Gewalt, wenn irgendwelche Straßen dadurch gesperrt sind oder aber auch Fassadenschäden am Logistikobjekt oder aber auch an den Fahrzeugen Schäden entstehen.
","Disch2: Und Verkehr klar, man kann nicht so schnell fahren oder es gibt Unfälle, das sieht man ja auch wenn man selbst PKW fährt, dann kann man halt nicht mit 180 km/h da durchbrettern, sondern dann muss man halt runter auf 110 km/h","Kolhof et al: ",,,,,,,
,"Starkregen","Gefahr für Leib und Leben durch reißende Fluten an Fließgewässern, in Tiefgaragen, etc. ","Wasserversorgung","Personal","Gemeinde Gutach","Deutschland","Hochlagen",,"Gem Gut: Richtung Haslach und Elzach, da war ein größerer Hangrutsch, da bin ich selbst gerade heimgefahren. [unverständlich]Und da war der ganze Hang abgegangen und ich bin dann gerade in der Kurve vorne dran gestanden. Ich habe es nicht gesehen aber vor mir waren zwei LKWs und zwei, drei Autos und gerade um die Kurve herum ist da der Hang runter, wo halt das Starkregenereignis war. Kurzfristig hat der Hang sich gelöst. Da war vor ein paar Jahren schonmal was, wo man versucht hat den Hang mit Steinen zu stabilisieren, aber das war nur ein kleiner Fleck was man da ausgebessert hat und jetzt ist der ganze Hang runter. Und dann ist nichts mehr gegangen und ich habe gemerkt wie die Flüsse ansteigen. Mir war es dann auch etwas mulmig, wo ich gemerkt habe, so ein kleiner Fluss –der eigentlich unbedeutend ist –wie der immer mehr in die Breite gegangen ist und dann ist er auch da oben heruntergekommen. Da habe ich gesagt: „Ok da geht gar nichts mehr, Hangrutsch.“Dann haben natürlich alle gewendet und versucht aus der Gefahrenzone herauszufahren","Gem Gut: Wir hatten vor wenigen Wochen die Situation... Sommermonate, schönstes Wetter beiuns, Sonnenschein, im oberen Elztal, wo der Hangabgang war, Starkregen, eine Gewitterzelle wo nur da oben im oberen Elztal gestanden ist und drüben die Leute sind Corona bedingt auch viel an den Flüssen gewesen. Da war eine Frau mit ihren zwei Enkelkindern. Drüben bei uns an der Elz, im oberen Elztal geregnet und dann kam eine Welle oben runter mit Schlamm und Geröll und Baumstämme, die waren noch im Wasser, sind nicht mehr herausgekommen, waren dann auf einer kleinen Sandbank. Das war eine Riesen Aktion mit unserer Feuerwehr, die Kinder konnten Sie dann rüber ziehen, die Oma nicht, die musste dann mit dem Hubschrauber rausgezogen werden, war richtig was los. Und das war hier unten total harmlos, Sonnenschein. Im oberen Elztal ging auf Deutsch gesagt die Post ab",,,,,,,,,
,"Starkregen; Gewitter & Hagel; Sturm","Ausfall von Mitarbeitern auf Grund von Unwetterschäden im privaten Bereich und Aufräumeinsätzen","Logistik","Personal","Disch2","Deutschland","Tieflagen",,"Disch2: Regen in der Form habe ich für uns jetzt bisher als keine große Herausforderung erlebt. Außer wenn es jetzt extrem regnet und ich persönlich den Keller unter Wasser habe. Was auch schon passiert ist.",,,,,,,,,,
,"Starkregen; Gewitter & Hagel; Sturm","extremwetterbedingte Schäden an nicht-versichterten Materialien an Baustellen --> Gefahr finanzieller Verluste, Kunden-Unzufriedenheit ","Bausektor","Betriebsmittel; Absatz","D1; B1","Deutschland","Tieflagen"," ","Hars et al. S. 37; S. 48",,,,,,,,,,
,"Starkregen; Gewitter & Hagel; Sturm","Schäden & Ertragseinbußen an Anbaupflanzen (Getreide, Gemüse, Sonderkulturen, Jungbäume)","Forst- und Holzwirtschaft; Landwirtschaft","Rohstoffe; Absatz","Weingut Faber, u.a.",,,,"Nagy 2017","Stech 2021","Dörr 2021","Raab 2020, S. 49",,,,,,,
,"Starkregen; Gewitter & Hagel; Sturm","Auftragsschwankungen durch unregelmäßiges Auftreten von Extremwetterereignissen und folgenden Reparaturarbeiten","Bausektor","Absatz; Management","D1; B1","Deutschland","Tieflagen",,"Hars et al, S. 39; S. 48",,,,,,,,,,
,"Starkregen; Gewitter & Hagel; Sturm","Aufkommen neuer, extremwetterresistenter Produkte  -> Risiko: Verdrängung konventioneller Produkte und Betriebe","Bausektor","Betriebsmittel; Absatz","D1; B1","Deutschland","Tieflagen","Zusatzkosten für Schulungen und Beschaffung neuer Baumaterialien; aber auch Chance zur Verbesserung der Auftragslage","Hars et al. S. 39; S. 47/48",,,,,,,,,,
,"Gewitter & Hagel","Schäden an Gebäuden, Betriebsmitteln, gelagerter Ware","Landwirtschaft; Logistik","Betriebsmittel ","Doll","Deutschland","Tieflagen; mittlere Lagen",,"Doll: Das ist ein Thema und im Bereich, wo man sagt, ja okay man hat an Fahrzeugen oder sonstigen einfach Schäden erlitten, so ein Hagelschaden oder sowas, aber das ist ja von den Versicherungen abgedeckt.
","Nagy 2017",,,,,,,,,
,"Gewitter & Hagel","Schäden an Kritischer Infrastruktur, z. B. PV-Anlagen","Energiewirtschaft; Forst- und Holzwirtschaft","Betriebsmittel; Kritische Infrastruktur","SWMS; Holzbearbeitung Heinzelmann","Deutschland","Tieflagen; mittlere Lagen",,"SWMS: Hagel  auch  nicht,  zumindest  nicht  für  die Wasserversorgung.  Im  Bereich  Solaranlagen,  Photovoltaik  klar,  weil  unsere  Anlagen  dann Schaden nehmen können","HH: Gewitter und Hagel, ja gut, es kann halt sein, dass unsere  Fotovoltaik  Anlagen  Schaden davon nehmen,  aber  die  werden für  sowasauchversichert",,,,,,,,,
,"Gewitter & Hagel","Reparaturaufträge nach Hagelschäden erfordern kurzfristige Umplanungen und Mehraufwand","Verarbeitendes Gewerbe","Management","Hévron","Schweiz","mittlere Lagen; Hochlagen",,"SB : […] Et concernant un épisode de grêle ? Hevron a déjà fait face à ça ? GC : Oui, c'est clair que s'il grêle sur un chantier, ben on s'arrête et on va dans les cabanes de chantiers. Ce n'est pas significatif pour nous. ",,,,,,,,,,
,"Hitze; Dürre; allg. Temperaturanstieg; Starkregen; Gewitter & Hagel","Ernteeinbußen in der Landwirtschaft führen zu Umsatzrückgang in nachgelagerten Branchen","Logistik","Absatz; Rohstoffe","Dischinger","Deutschland","Tieflagen",,"wo ich noch was merke, ist wenn wir Hagel haben oder so, weil unsere Kunden natürlich dann auch umweltmäßig da betroffen sind, gerade weil wir eine Weinregion sind. Das merken wir auch. Wenn’s unseren Winzern nicht so gut geht, dann geht’s uns auch nicht so gut. Am Anfang des Jahres haben wir gedacht: „Scheiße, der Wein wird nicht so gut“. Aber jetzt haben wir ja Glück gehabt am Schluss. ",,,,,,,,,,
,"Sturm","Schäden auf dem Betriebsgelände, am Gebäude, an gelagerten Betriebsmitteln, etc. --> Risiko: ungenügender Versicherungsschutz","Getränkeindustrie; Logistik; Bausektor; Verarbeitendes Gewerbe","Betriebsmittel ","Decker Bier; Lieler Schlossbrunnen; Spedition Kleyling; U2; B1; C2; Schreinerei Burkard; Hévron; Gaggenau; Klotz","Deutschland; Schweiz; Frankreich","Tieflagen; mittlere Lagen; Hochlagen","z. B. Dach von Hütte beschädigt; Leergut im Hof könnte umfallen; Hallendach abgedeckt durch Orkan Lothar 1999; Verwehungen von Arbeitsmaterial oder Substrat zur Dachbegrünung; PV-Anlagen werden beschädigt, vom Dachgeweht; Schäden an Betriebsgebäuden durch umgestürzten Baum","Einmal hatten wir Sturm, der uns das Dach von der Hütte abgedeckt hat. Das war [...] –wir dachten eigentlich, weil das so ein Bausatz war für das Dach, das ist eigentlich fest genug. Hat nicht gereicht und wir mussten eine Eigenkonstruktion machen","Was noch eine Rolle spielt ist Starkwind. Also aufgetreten nicht wirklich aber wenn mal so Starkwind istim Hof bei uns –da steht auch das Leergut –ist dann auch mit Wind verbunden, dass viele Kisten umfallen, wenn so ein richtiger Starkwind herrschen würde","Also Regen in Zusammenhang mit Sturm, das kennen wir ja schon von vor ein paar Jahren mit Lothar. Der hat damals ein Dach abgedeckt von einer Halle, aber das war es dann auch schon. Mehr Erfahrungen haben wir bisher noch nicht.","Hars et al. S. 48; S. 56","Münch: Starker Wind? Burkard: Ja. Wann war das, Lothar? Münch: […] Ist hier auch etwas konkret passiert durch den Wind? Gab es irgendwelche Schäden? Burkard: Gering. Also wir hatten Schäden am Dach durch umstürzende Bäume, aber die waren gering.","Les vents aussi : On ne peut pas faire fonctionner la grue, s'il y a un ouragan, c'est la catastrophe aussi, cela provoque de la casse, des éléments qui tombent, il faut tout recommencer. ","C'est arrivé la semaine passée. C'est un cas d'une injustice incroyable. Voilà notre bâtiment de thermo-poudrage, et lundi [6.03.2017], l'arbre est tombé, un peuplier qui était là depuis que j'étais enfant. Il y a eu du vent à 98km/h le dimanche soir. Il est tombé et à endommagé les vieux ateliers que l'on a dans le village. On est en train de les déménager. On voit que l'arbre a tout pété. Voilà, et l'ECA sont venus et ont expliqués leur fonctionnement : Pour qu'ils entrent en matière [et donc qu'ils remboursent une partie des dégâts], il faut qu'il y ait des vents de 60km/h pendant une période de 15 minutes non-stop, ce qui n'existe pas. Ou des rafales de plus de 105 km/h, je crois. On ne remplit aucune de ces deux conditions. Troisième critère important : il faut qu'il y ait d'autres dégâts dans le périmètre. En l'occurrence, l'arbre qui est tombé ici a fait des dégâts très isolés. Donc là, on a rien reçu, c'était tout à nos frais. On a une assurance privée qui a des critères moins lourds. Les pointes de vent étaient à 95 km/h dans ce cas-là : la Mobilière [assurance suisse] paie à partir de 85 km/h par exemple. Mais il aurait fallu également des dégâts avoisinants, ce qui n'était pas le cas. Bref, on ne va pas réparer, parce qu'on a le projet de déménagement de ces anciens ateliers vers nos locaux ici. ","Le 2ème risque qu’on a connu, c’est sur ce bâtiment-là. On a un toit plat, bitumé, avec des gravillons qui permettent de garder le bitume ?. En fait lors de la tempête de 99, le vent a soulevé ces gravillons et a percuté toute la façade vitrée qu’on a ici. Donc on a eu pratiquement toute la façade vitrée qui était défoncée. On a réparé, et suite à notre réunion du mois d’avril, je me suis renseigné, j’ai demandé, qu’est-ce qu’on a fait contre ça ? On a remis du gravillon ! Donc j’ai dit, faudrait peut-être qu’on songe à mettre autre chose, des galets ou des choses comme ça. C’était le plus gros sinistre qu’on avait à l’époque. On a aussi eu des toits qui se sont soulevés, des choses comme ça, mais à la limite c’étaient des petits bobos, mais ça, c’était la chose à laquelle on ne se serait jamais attendus…","Kolhof et al: Zudem  können  Betriebsgebäude  oder  anderwärtige Betriebsmittel durch starke Windböen umgerissen und/oder beschädigt werden. Im Falle der Firma Klotz wurde unter anderem eine Lichtkuppe vom Dach gerissen oder die Waschanlage der LKW umgeweht und beschädigt.  ",,
,"Sturm","Gefahr für Personal durch umherfliegende oder umstürzende Gegenstände","Logistik","Personal","Contargo","Deutschland","Tieflagen",,"Kolhof et al. 2018",,,,,,,,,,
,"Sturm","erhöhter Arbeitsaufwand wg. Sicherung gefährdeter Waren und Betriebsmittel","Logistik","Personal; Management",,"Deutschland","Tieflagen",,"Kolhof et al. 2018",,,,,,,,,,
,"Sturm","bei Sturm Unterbrechung des Betriebs in Seehäfen --> Verzögerungen in der Lieferkette","Logistik","Produktion / Betrieb; Lieferkette","Contargo","Deutschland","Tieflagen",,"Kolhof et al. 2018: Laut Contargo ist bei Starkwind zudem die Einstellung des Betriebes vor allem in den Seehäfen    möglich,    was    wiederum    Verzögerungen    im    Arbeitsablauf    und    somit Lieferverzögerungen  zur  Folge  hat.",,,,,,,,,,
,"Sturm; Starkregen; Gewitter & Hagel","Verhinderung von Freizeitaktivitäten im Außenbereich bei Schlechtwetter, auch wg. Sicherheitsvorkehrungen","Tourismus","Absatz; Betriebsmittel",,,,"z. B. Ausbleiben von Skifahrern, Schließung von Liften bei Sturm und Unwetter","Daus 2017",,,,,,,,,,
,"Gewitter & Hagel; Sturm","Unterbrechung von Arbeiten im Freien, auf Baustellen, etc --> Zeitverlust, geringere Arbeitsproduktivität, Umplanungen erforderlich","Bausektor; Verarbeitendes Gewerbe; Logistik","Produktion / Betrieb; Management","B1; Hévron; Contargo","Deutschland; Schweiz","Tieflagen; mittlere Lagen; Hochlagen","Kräne können nicht arbeiten; ggfs mehrere Tage am Stück","Hars et al. S. 48","[...] quand il y a du vent fort, on ne peut pas utiliser la grue, on a pas le droit de l'utiliser. Je peux vous montrer un truc sur l'ordinateur [GC montre des images à l'écran]. Voilà nos plus grands chantiers, c'est ça que je voulais vous montrer : C'est là qu'on a été impacté par un grand vent. C'est à côté de Bâle, voyez, on monte des éléments comme ça. Quand les employés ne peuvent pas utiliser la grue, ils doivent faire autre chose s'ils peuvent, quand il y a d'autres travaux à faire. Mais s'il y a du vent pendant trois jours, c'est une catastrophe pour nous car le planning est au jour près, ce n'est pas en semaine. On sait que le mardi on doit monter... Le voilà ce fameux bâtiment [GC montre la construction en question à l'écran]. Chaque pièce a été construite ici, il y en a des milliers, et ces éléments, il faut en poser un certain nombre par jour. On s'engage en semaine à en avoir posé 12. Une fois on n’a pas pu les poser, voilà. On a renvoyé les employés à la maison. Quand c'est les notre, ça va, mais quand on a des employés sous-traitants qui travaillent au forfait, ils râlent un peu. Cela leur rallonge leur travail, il faut s'arranger.","Kolhof et al. 2018",,,,,,,,
,"Gewitter & Hagel; Sturm","Unterbrechungen der Stromversorgung durch Blitzeinschläge oder Schäden an Stromleitungen --> Ausfall von IT und elektronischen Geräten, Unterbrechungen im Betrieb","Energiewirtschaft; Logistik; Forst- und Holzwirtschaft; Getränkeindustrie","Betriebsmittel; Kritische Infrastrukur; Produktion / Betrieb","IWB; Contargo; Schreinerei Burkard; Lieler","Schweiz; Deutschland","Tieflagen","Schäden v.a. an älteren Stromtrassen","IWB: Gewitter & Hagel hat einen gewissen Einfluss auf die Stromversorgung, genauso wie Stürme. Wenn Stürme und starke Gewitter zunehmend, dann kann es zu mehr Stromunterbrüchen    führen.    Das    ist    abzuwarten;    bisher    sind    wir    mit    der    Basler Stromversorgung gut aufgestellt, aber bei Stromtrassen, die älter sind oder in Gebieten sind, wo   das   extrem   zunimmt,   kann   es   unter   Umständen   zu   mehr   Unterbrüchen   in   der Stromversorgung führen","Kolhof et al. 2018","Ansonsten, was mir noch einfallen würde wäre, dass wenn öfter starke Gewitter wären und ein Blitz einschlägt, dass dann die elektronischen Geräte gefährdet sind. Aber das ist eine Prognose. Das ist nichts, was jetzt schon stattgefunden hat.","Lieler: Wie gesagt, wirklich aufgetreten davon, dass man jetzt sagen kann das war jetzt mal so anders, dass man gar nicht produzieren konnte oder so, das war eigentlich auch nicht so. Wenn dann mal einen Stromausfall gewitterbedingt.",,,,,,,
,"Sturm; Dürre; Hitze; allg. Temperaturanstieg","Unzugänglichkeit von Waldwegen und Mountainbiketrails auf Grund umgestürzter Bäume --> Attraktivitätsverlust, Unfallgefahr","Tourismus","Absatz",,,,,"Kolb & Konrad 2021",,,,,,,,,,
,"Kälte & Frost","Erhöhung des Heizenergiebedarfs","Logistik; Verarbeitendes Gewerbe","Kritische Infrastruktur; Finanzen","Dischinger; Hévron; Gaggenau; Contargo","Deutschland; Schweiz","Tieflagen; mittlere Lagen","Aufstellen von Heizpilzen in Montagehalle; Enteisung von Containern","Und wir stellen auch fest, unsere Heizphase ist auch länger. Spannenderweise. Ich kann’s nur nicht so ganz greifen, warum, aber es ist auch länger.[…] Wir haben einen höheren Gasverbrauch. [d.h. steigende Ausgaben für Gas, Anm. NS]","Les froids intenses impactent aussi notre consommation en gaz, on consomme plus.[…] Les kilowatts/heures, on est quand même un gros consommateur parce que nous transformons l'acier, on soude et cela pompe beaucoup d'énergie, il y a là beaucoup de machines. Mais tout est relativement stable, sauf ici, le gaz qui bouge un peu en fonction de la météo. Là on peut observer des variations d'année en année, de l'ordre de 5 à 10%, pas plus. ","Gag: zone magasin[…] les gens qui travaillent dans ces zones là sont équipés de parasols chauffants. Parce que les pièces en métal, c'est froid, c'est vraiment comme si vous travailliez dans une chambre froide","Kolhof et al. 2018",,,,,,,
,"Kälte & Frost; Schnee","Eis und Schnee auf Oberflächen: Gefahr von Arbeitsunfällen","Verarbeitendes Gewerbe; Logistik","Personal; Betriebsmittel","Gaggenau; Contargo","Frankreich; Deutschland","Tieflagen ",,"Gag: il y a pu y avoir des plaques de gel sur lesquelles les gens ont glissé","Kolhof et al. 2018",,,,,,,,,
,"Kälte & Frost","Unterbrechung von Arbeiten im Freien und in kalten Innenräumen","Verarbeitendes Gewerbe; Logistik","Produktion / Betrieb","Hévron; Contargo","Schweiz; Deutschland","Tieflagen; mittlere Lagen; Hochlagen","z. B. Vereisung von Rheinhäfen","On est très dépendant de la météo, en hiver on est ralenti. Quand on va se battre pour une affaire, on ne peut pas prétendre dès le départ qu'il y aura du retard parce que c'est l’hiver et qu'il y a de la neige. C'est la date qui figure sur le contrat signé qui fait fois, le reste c'est notre problème. Cela signifie que quand on est sur nos chantiers dans la Vallée de Joux et qu'il y a un mètre de neige, ben on ne peut pas bosser. Et puis on fait aussi de l'étanchéité de toiture, pour laquelle il faut des températures acceptables pour pouvoir travailler. [...] Quand il fait trop froid, avec la glace ou quand il y a trop de neige, on ne peut rien faire non plus. ","Kolhof et al. 2018",,,,,,,,,
,"Kälte & Frost","Einschränkungen und Unterbrechungen im Betrieb wegen kältesensibler Maschinen, Geräte und Materialien ","Verarbeitendes Gewerbe; Forst- und Holzwirtschaft; Logistik; Landwirtschaft","Produktion / Betrieb; Betriebsmittel","Hévron; Gaggenau; Holzbearbeitung Heinzelmann; Doll; Contargo; Ringlihof","Schweiz; Frankreich; Deutschland","Tieflagen; mittlere Lagen","z. B. Metallteile oder Industriekleber können nicht verarbeitet werden, wenn sie zu kalt sind; Wasserleitungen in Ställen frieren ein","Aussi, on a des normes avec le verre : au chantier, ce sont des ventouses (Sauger) qui prennent le verre et qui les posent lors du montage. Ces ventouses, on n’a pas le droit de les utiliser dès que la température est en dessous de 3°C. Parfois, nous sommes bloqués à cause de la ventouse. ","Gag: Problèmes avec les matériaux surtout en hiver. On fait de l’emboutissage de tôle, les tôles doivent être au minimum entre 12 et 15°C avant de pouvoir les travailler. Il faut les mettre au chaud en hiver car les halls de stockage ne sont pas chauffés […] La tôle stockée en extérieur, on est forcé de la rentrer 3-4 jours avant de la travailler [...] vous avez certaines colles, des silicones et certains produits sensibles qu'il faut maintenir à une température minimum de 7-8°C","HH: Extreme Kälte ist immer ein Problem auf Sägewerken, weil die Hallen in vielen Fällen nicht geheizt sind undwenn man mit Druckluftarbeitete,hat man einen gewissen Wassergehalt (...) der gefriert dann über  Nacht,  aber  ist  jetzt  auch  nichts  Neues. ","Doll: Kälte. Da hat man ja natürlich bei extremer Kälte […] natürlich auch negative Effekte auf Fahrzeuge, auf LKW zum Beispiel. Merkt man dann schon, ja.",,,,,,,
,"Kälte & Frost","Umplanung wegen kurzfristigen kältebedingten Verzögerungen und Unterbrechungen","Verarbeitendes Gewerbe","Management","Hévron","Schweiz","mittlere Lagen; Hochlagen",,"On est très dépendant de la météo, en hiver on est ralenti. Quand on va se battre pour une affaire, on ne peut pas prétendre dès le départ qu'il y aura du retard parce que c'est l’hiver et qu'il y a de la neige. C'est la date qui figure sur le contrat signé qui fait fois, le reste c'est notre problème. Cela signifie que quand on est sur nos chantiers dans la Vallée de Joux et qu'il y a un mètre de neige, ben on ne peut pas bosser. Et puis on fait aussi de l'étanchéité de toiture, pour laquelle il faut des températures acceptables pour pouvoir travailler. [...] Quand il fait trop froid, avec la glace ou quand il y a trop de neige, on ne peut rien faire non plus. ",,,,,,,,,,
,"Kälte & Frost","Beeinträchtigung von Gesundheit und Komfort der Angestellten bei Arbeiten im Freien","Verarbeitendes Gewerbe","Personal","Hévron","Schweiz","mittlere Lagen; Hochlagen",,"10% de nos employés travaillent en extérieur. Il n'y a pas de moyen pour les rendre insensible au changement climatique. En hiver, je leur donne des habits très chauds",,,,,,,,,,
,"Kälte & Frost","Beeinträchtigung von Gesundheit und Komfort der Angestellten bei Arbeiten in nicht (ausreichend) beheizten Innenräumen","Verarbeitendes Gewerbe; Forst- und Holzwirtschaft","Personal","Hévron; Holzbearbeitung Heinzelmann","Schweiz; Deutschland","mittlere Lagen",,"SB : Et des froids intenses, ou des gelées ? GC : Oui. Cela n'a pas de conséquences sur les bâtiments, toutefois nous chauffons au gaz d'énormes surfaces où les portes s'ouvrent tout le temps, il faut aérer à cause des fumées... donc oui, cela a un petit impact : nos employés avaient froid, ce n'était pas idéal. Quand il fait -20°C, dans les ateliers il doit faire 5°C ! C'est leur confort qui est impacté. Mais le travail n'est pas interrompu. Cela engendre quand même une baisse de productivité, mais on bossera quand même au chantier par -20°C. ","HH: Extreme Kälte ist immer ein Problem auf Sägewerken, weil die Hallen in vielen Fällen nicht geheizt sind undwenn man mit Druckluftarbeitete,hat man einen gewissen Wassergehalt (...) der gefriert dann über  Nacht,  aber  ist  jetzt  auch  nichts  Neues. ",,,,,,,,,
,"Kälte & Frost","sinkende Arbeitsproduktivität wg. geringerem Komfort der Angestellten","Verarbeitendes Gewerbe; Forst- und Holzwirtschaft","Personal","Hévron; Gaggenau; Sägewerk 3","Schweiz; Frankreich; Deutschland","Tieflagen; mittlere Lagen; Hochlagen","z. B. mehr Pausen zum Aufwärmen, mehr Fehlzeiten wegen Erkältungen","donc oui, cela a un petit impact : nos employés avaient froid, ce n'était pas idéal. Quand il fait -20°C, dans les ateliers il doit faire 5°C ! C'est leur confort qui est impacté. Mais le travail n'est pas interrompu. Cela engendre quand même une baisse de productivité, mais on bossera quand même au chantier par -20°C. ","Gag: On a une zone magasin où on peut mettre un peu de chauffage, et les gens qui travaillent dans ces zones là sont équipés de parasols chauffants pour pouvoir se réchauffer. Parce que les pièces en métal,c’est froid, c’est vraiment comme si vous travailliez dans une chambre froide","Säge 3: Extreme  Kälte: Das  würde  uns  schon  extrem  erschweren.  Also Kälteund  viel  Schnee  das behindert uns schon",,,,,,,,
,"Kälte & Frost","Frostschäden an asphaltierten Flächen --> erhöhte Instandhaltungskosten","Logistik ","Betriebsmittel","Contargo","Deutschland ","Tieflagen",,"Kolhof et al. 2018",,,,,,,,,,
,"Kälte & Frost; Schnee","zusätzliche Ausgaben in strengen Wintern für Streusalz, Schneeketten, etc.","Logistik","Betriebsmittel; Finanzen","Contargo","Deutschland ","Tieflagen",,"Kolhof et al. 2018",,,,,,,,,,
,"Kälte & Frost; allg. Temperaturanstieg","zunehmendes Risiko von Spätfrostschäden","Landwirtschaft","Rohstoffe; Absatz",,,,"durch Kombination aus früherem Austrieb der Pflanzen in milden Wintern und Spätfrost besonders schädlich; v.a. bei Obst- und Sonderkulturen","Nagy 2021",,,,,,,,,,
